author|title|content
lanacion.com|Pampita Ardohain y Mariano Balcarce, a los besos en un boliche porteño|Fuente: LA NACION - Crédito: Gerardo Viercovich  La relación entre   Pampita Ardohain  y Mariano Balcarce marcha viento en popa. La modelo y el empresario no tienen pudor a la hora de demostrar su amor y no se esconden de la gente. Este fin de semana fueron j… [+1364 chars]
lanacion.com|"Confesiones de una adicta al sexo: ""Llegué a tener relaciones con seis tipos en una noche, pero cambié por mi hijo"""|Lauirie Woodruff es una joven británica que relató en un libro cómo su obsesión por lo sexual controlaba su vida   Crédito: Instagram  Laurie Woodruff es una mujer de 30 años de la localidad de Sheffield, en Gran Bretaña, que pasa sus horas entre el estudio y… [+4187 chars]
lanacion.com|Video: la emoción de un padre al recibir la camiseta de su equipo con el nombre de su hija futbolista|"El fútbol transmite pasiones inexplicables que se heredan de generación en generación. Y los sueños que inundan las tribunas cada fin de semana se comparten, tal como le sucedió a la futbolista española Maite ""Mai"" Garde, quien anhelaba jugar con   Osasuna  ,… [+1579 chars]"
lanacion.com|A 30 años del nacimiento de la Web, su fundador, Tim Berners-Lee, pide una declaración universal que la proteja y defienda a los usuarios|Tim Berners-Lee, el creador de la Web  Tim Berners-Lee, el creador de la World Wide Web, difundió una carta a propósito de los 30 años de la creación de la Web, que reproducimos aquí.   Hoy, 30 años después de   mi propuesta original para crear un sistema de … [+6554 chars]
lanacion.com|River blinda a su nueva joya: cuánto subió la cláusula de rescisión en el contrato de Cristian Ferreira|Cristian Ferreira, la nueva joya de River   Fuente: FotoBAIRES  La ebullición que produjo el auspicioso presente de   Cristian Ferreira  obligó a River a accionar rápido para evitar futuros conflictos. A sabiendas del potencial que tiene el joven cordobés de … [+2258 chars]
lanacion.com|"En Houston, Dujovne y Lopetegui lucieron logros en Vaca Muerta en busca de la esquiva ""lluvia de inversiones"""|El ministro de Hacienda, Nicolás Dujovne, brindó un discurso en el IAPG; lo acompañó el secretario de Energía, Gustavo Lopetegui  WASHINGTON.-   Nicolás Dujovne  aterrizó en Houston con la tranquilidad que generó, para el oficialismo, la derrota del kirchneri… [+3826 chars]
lanacion.com|"Cande Tinelli: ""Trato de no leer las cosas negativas, me quedo con lo bueno"""|Tiene un perfil muy alto en las redes sociales, sin embargo, en cuanto a apariciones televisivas, siempre se mantuvo al margen. Invitada por Vero Lozano a su programa,   Candelaria Tinelli  hizo una rara aparición en la pantalla chica, en donde habló de su fa… [+3628 chars]
lanacion.com|Respaldan la investigación sobre las coimas en las obras del tren Sarmiento|La Cámara Federal rechazó planteos de De Vido y de las constructoras Iecsa y Odebrecht, que pidieron la nulidad de los documentos acumulados en Brasil   Fuente: LA NACION  La Cámara Federal porteña rechazó ayer los planteos de las defensas del exministro Juli… [+3199 chars]
lanacion.com|Macri -Vidal: pedido de disculpas por la ayuda que no llegó a Buenos Aires|Crédito: Prensa Gobernación  LA PLATA.-El presidente Mauricio Macri visitó esta mañana la Casa de Gobierno de la provincia de Buenos Aires para participar de una reunión de Gabiente junto a María Eugenia Vidal. En esta capital, sorprendió con una frase que pa… [+1918 chars]
lanacion.com|"""Creo que Lavagna puede ser un gran candidato a presidente"", dijo Marcelo Tinelli tras el almuerzo con el exministro"|Después de reunirse con el dirigente del PJ, el conductor televisivo mostró su apoyo   Fuente: LA NACION - Crédito: Gerardo Viercovich  Tras el almuerzo que mantuvo con el exministro de Economía,   Roberto Lavagna,  el conductor televisivo   Marcelo Tinelli  … [+777 chars]
lanacion.com|"Susana Giménez, sobre la gestión de Macri: ""La gente está triste, no le alcanza la guita"""|Fuente: LA NACION - Crédito: Gerardo Viercovich  Susana Giménez  ofreció una larga entrevista para el programa de Angel de Brito en la emisora que debutó hoy, CNN Radio. Allí se refirió al año electoral y no ahorró en críticas hacia la gestión del presidente … [+2112 chars]
lanacion.com|Matías Morla dio a entender que hay un cuarto hijo de Maradona en Cuba|El abogado de Maradona conoció a un chico que podría también ser hijo de El Diez   Luego de que trascendiera la noticia de que   Diego Maradona  iba a reconocer   a tres hijos en Cuba, una nueva noticia sobre los herederos no reconocidos del crac futbolístico… [+1818 chars]
lanacion.com|Peligra el compromiso de Jennifer Lopez y Alex Rodriguez|Un deportista acusa a Rodriguez de haberle sido infiel a la cantante latina por Twitter    Crédito: The Grosby Group  Jennifer Lopez  y Alex Rodriguez   se comprometieron con un anillo de diamantes que, se estima, está valuado en 4.5 millones de dólares. Pero… [+2024 chars]
lanacion.com|"Pichetto: ""Se empiezan a caer las caretas, Cristina no supera el 25%"""|"El jefe del bloque de senadores justicialistas   Miguel Pichetto  se reunió este lunes con el gobernador   Juan Schiaretti  , quien completó así encuentros con todos los precandidatos a presidente de Alternativa Federal.  ""Se empiezan a caer las caretas: la c… [+1590 chars]"
lanacion.com|Cinco siglos después, España y Portugal se pelean por la primera vuelta al mundo|La conmemoración del V centenario de la expedición resucita la vieja polémica de la participación de ambos países en la vuelta al mundo  MADRID.- Nada como una hazaña -o su conmemoración- para agitar nacionalismos. Eso es lo que ocurre ahora entre historiador… [+3376 chars]
lanacion.com|Serrat y Sabina volverán a la Argentina con su gira No hay dos sin tres|Una buena noticia para su público, que no perdía las esperanzas de volver a verlos juntos sobre un escenario   Fuente: Archivo  La leyenda escrita conjuntamente por   Joan Manuel Serrat y   Joaquín Sabina tendrá un nuevo episodio en la Argentina este año.   A… [+849 chars]
lanacion.com|"Vidal pidió ""humildad"" y recordar que a muchos ""les cuesta llegar a fin de mes"""|"Durante el encuentro nacional de PRO, María Eugenia Vidal pidió este lunes a la dirigencia oficialista tener ""humidad"" al momento de encarar la campaña y tener en cuenta que ""hay muchas familias a las que les cuesta llegar a fin de mes"".  Así, la gobernadora … [+2606 chars]"
lanacion.com|Los mejores del mundo: Gallardo y River, los primeros en un ranking de clubes|River y Gallardo, reconocidos en un ranking mundial   Fuente: AP  Las buenas noticias siguen para   River  . Esta semana, los millonarios desplazaron a Real Madrid y treparon al primer lugar de un ranking mundial. Además, en la misma publicación, el entrenado… [+1036 chars]
lanacion.com|ElectroFest: Las cadenas buscan reactivar el consumo con descuentos de hasta el 30% y cuotas sin interés|.  Desde hoy y hasta el miércoles inclusive, las principales cadenas de electrodomésticos del país realizan la primera edición de   Electrofest, la liquidación en la que se ofrecen productos con descuentos de hasta el 30% y hasta 24 cuotas sin interés, con lo… [+3958 chars]
lanacion.com|Andrea del Boca quiere llegar al juicio oral|La actriz enfrenta una causa penal por malversación de fondos públicos    Fuente: Archivo  Esta vez fue   Andrea del Boca  , a través de su abogado defensor, el Dr. Juan Pablo Fioribello, quien dio un paso más en el avance de   la causa penal que la involucra… [+2561 chars]
lanacion.com|Euro hoy: a cuánto cerró el euro en Banco Nación y todas las entidades el 11 de marzo|None
lanacion.com|Dólar hoy: a cuánto cerró el dólar en Banco Nación y todas las entidades el 11 de marzo|Dólar hoy: a cuánto cerró el dólar en Banco Nación y todas las entidades el 11 de marzo   Fuente: LA NACION  La divisa operó estable. En el   Banco Nación, se ubicó a $42,25. Mientras tanto, en otros bancos privados ICBC - $42,65, Banco Santander Río - $42,50… [+297 chars]
lanacion.com|La semana comenzó con solo 418 vacunos en el Mercado de Liniers|Se pagó un máximo de 64 pesos por kilo de terneras   Fuente: Archivo  La primera jornada de ventas de la semana en el Mercado de Liniers mostró ayer una oferta muy reducida, con solo 418 vacunos, y un escaso número de operadores de compra del abasto y de la i… [+1546 chars]
lanacion.com|Cómo es el Boeing 737-Max 8 que está en el centro de la polémica|Es el modelo más nuevo del 737, la aeronave más vendida de Boeing   Fuente: AFP  CHICAGO.- El modelo más reciente del 737 más vendido de la familia   Boeing  -caballo de tiro de la industria aeroespacial- quedó nuevamente en el centro de la polémica tras   el… [+5347 chars]
lanacion.com|¿Por qué me siento tanto cansado?|¿Con sueño y falta de concentración a mitad de la mañana?   Crédito: janprazak / Pixabay  A poco de   volver de las vacaciones, o de un fin de semana al aire libre, la expectativa es estar con las pilas recargadas y   la disposición para encarar la agenda dia… [+7748 chars]
lanacion.com|Alerta por el show de Paul McCartney: clausuran preventivamente el Campo de Polo para recitales|El Campo de Polo el sábado último, durante la presentación de Hernán Cattáneo   Crédito: DIEGO SPIVACOW / AFV  La Agencia de Protección Ambiental (APRA) clausuró preventivamente el Campo Argentino de Polo solo para la realización de shows masivos. La medida s… [+1513 chars]
lanacion.com|El regreso de Germán Paoloski a Telefe|Fuente: Archivo  Finalmente llegó el día en el que   Germán Paoloski  regresó a la pantalla de Telefe.   Tal como lo había anunciado LA NACION, el periodista se puso este lunes al frente de   El Noticiero de la Gente, programa que durante 2018 estuvo bajo la … [+1097 chars]
